URL,product_id,Русский slug,Украинский slug,images,item_name,category_name,manufacturer_name,sku,model,stock_status,is_active,warranty,price,Русский title,Русский description,Украинский title,Украинский description,Тип устройства
https://001.com.ua/rele-differentsialnogo-toka-e-relay-klr-121-e-next,new,,,https://001.com.ua/media/photos/enext/rele/enext-rele-differentsialnogo-toka-i0640004-photo.jpg ;; https://001.com.ua/media/photos/enext/rele/gabaritnye-razmery-enext-rele-differentsialnogo-toka-i0640004-photo.jpg,"Реле дифференциального тока e.relay.klr.121, E.NEXT",Прочие реле и переключатели,E.NEXT,i0640004,i0640004,instock,1,12,"564,55","Реле дифференциального тока e.relay.klr.121, E.NEXT","<h2>Описание товара</h2><p>Реле дифференциального тока предназначено для защиты распределительных сетей и электрооборудования от токов утечки и возгораний, людей от поражения электрическим током, вызванным повреждением изоляции проводников. Применяется на объектах энергетики, в промышленности и т.д. Может быть использовано для сигнализации в электроустановках, которые по техническим причинам не допускают перерывов в электроснабжении.</p> <h2>Технические характеристики</h2><table><tbody><tr><td>Регулировка уставки чувствительности по дифференциальному току, IΔn, мА</td><td>100, 200, 300, 400, 500, 600, 700, 800, 900,1000</td></tr><tr><td>Регулировка уставки задержки срабатывания по времени</td><td>100, 250, 500, 750 мс; <br/>1, 1,25, 1,5, 1,75, 2, 2,25, 2,5, 2,75, 3 с</td></tr></tbody></table> ","Реле диференційного струму e.relay.klr.121, E.NEXT","<h2>Опис товару</h2><p>Реле диференційного струму призначене для захисту розподільних мереж та електрообладнання від струмів витоку і загорянь, людей від ураження електричним струмом, викликаних ушкодженням ізоляції провідників. Застосовується на об'єктах енергетики, в промисловості і т.д. Може бути використано для сигналізації в електроустановках, які з технічних причин не допускають перерв у електропостачанні.</p> <h2>Технічні характеристики</h2><table><tbody><tr><td>Регулювання уставки чутливості за диференційним струмом, IΔn, мА</td><td>100, 200, 300, 400, 500, 600, 700, 800, 900, 1000</td></tr><tr><td>Регулювання уставки затримки спрацьовування за часом</td><td>100, 250, 500, 750 мс; <br/>1, 1,25, 1,5, 1,75, 2, 2,25, 2,5, 2,75, 3 с</td></tr></tbody></table> ",Русский ~ Реле дифференциального тока
https://001.com.ua/rele-differentsialnogo-toka-e-relay-klr-123e-modulnoe-e-next,new,,,https://001.com.ua/media/photos/enext/rele/enext-rele-differentsialnogo-toka-i0640005-photo.jpg ;; https://001.com.ua/media/photos/enext/rele/gabaritnye-razmery-enext-rele-differentsialnogo-toka-i0640005-photo.jpg,"Реле дифференциального тока e.relay.klr.123e модульное, E.NEXT",Прочие реле и переключатели,E.NEXT,i0640005,i0640005,instock,1,12,"497,93","Реле дифференциального тока e.relay.klr.123e модульное, E.NEXT","<h2>Описание товара</h2><p>Реле предназначено для защиты людей от поражения электрическим током, защиты электрооборудования в случае повреждения его изоляции или возгорания. Реле оснащено регулировкой чувствительности по возникающему току утечки и времени срабатывания. Используется на объектах энергетики, в промышленности и т.д.</p> <h2>Технические характеристики</h2><table><tbody><tr><td>Регулировка уставки номинального отключающего дифференциального тока 1-й ступени IΔn, мА</td><td>30, 50, 75, 100, 125, 150, 200, 250, 300, 500, 750</td></tr><tr><td>Регулировка уставки номинального отключающего дифференциального тока 2-й ступени IΔn, А</td><td>1, 1.25, 1.5, 2, 2.5, 3, 5, 7.5, 10, 12.5, 15, 20, 25, 30</td></tr><tr><td>Регулировка уставки кратности отключающего дифференциального тока</td><td>×1, ×10, ×100</td></tr><tr><td>Регулировка уставки задержки срабатывания по времени, мс</td><td>50, 100, 150, 250, 350, 500, 1000, 3000</td></tr></tbody></table> ","Реле диференційного струму e.relay.klr.123e модульне, E.NEXT","<h2>Опис товару</h2><p>Реле призначене для захисту людей від ураження електричним струмом, захисту електрообладнання в разі пошкодження його ізоляції або загоряння. Реле оснащено регулюванням чутливості за струмом витоку і часу спрацьовування. Використовується на об'єктах енергетики, в промисловості і т.д.</p> <h2>Технічні характеристики</h2><table><tbody><tr><td>Регулювання уставки номінального відключаючого диференційного струму 1-го ступеня IΔn, мА</td><td>30, 50, 75, 100, 125, 150, 200, 250, 300, 500, 750</td></tr><tr><td>Регулювання уставки номінального відключаючого диференційного струму 2-го ступеня IΔn, А</td><td>1, 1.25, 1.5, 2, 2.5 , 3, 5, 7.5, 10, 12.5, 15, 20, 25, 30</td></tr><tr><td>Регулювання уставки кратності відключаючого диференційного струму</td><td>×1, ×10, ×100</td></tr><tr><td>Регулювання уставки затримки спрацьовування за часом, мс</td><td>50, 100, 150, 250, 350, 500, 1000, 3000</td></tr></tbody></table> ",Русский ~ Реле дифференциального тока
https://001.com.ua/izmeritelnaya-katushka-e-trans-cur-kct-40s-dlya-rele-tipa-klr-250-3-e-next,new,,,https://001.com.ua/media/photos/enext/rele/enext-izmeritelnaya-katushka-dlya-rele-i0640001-photo.jpg ;; https://001.com.ua/media/photos/enext/rele/gabaritnye-razmery-enext-izmeritelnaya-katushka-dlya-rele-i0640001-photo.jpg,"Измерительная катушка e.trans.cur.kct.40s для реле типа klr, 250/3, E.NEXT",Прочие реле и переключатели,E.NEXT,i0640001,i0640001,instock,1,12,"127,19","Измерительная катушка e.trans.cur.kct.40s для реле типа klr, 250/3, E.NEXT","<h2>Описание товара</h2><p>Трансформаторы тока предназначены для регистрации возникшего дифференциального тока и передачи его величины измерительному прибору — реле дифференциального тока e.relay.klr. Используются в цепях переменного тока.</p> <h2>Технические характеристики</h2><table><tbody><tr><td>Наибольший рабочий первичный ток, А</td><td>250</td></tr><tr><td>Номинальный ток вторичной обмотки, А</td><td>3</td></tr><tr><td>Класс точности</td><td>5Р, 10Р</td></tr><tr><td>Максимально-допустимое напряжение в измеряемой цепи, кВ</td><td>0,72</td></tr></tbody></table> ","Вимірювальна котушка e.trans.cur.kct.40s для реле типу klr, 250/3, E.NEXT","<h2>Опис товару</h2><p>Трансформатори струму призначені для реєстрації диференційного струму і передачі його величини вимірювальному приладові — реле диференційного струму e.relay.klr. Використовуються в колах змінного струму.</p> <h2>Технічні характеристики</h2><table><tbody><tr><td>Найбільший робочий первинний струм, А</td><td>250</td></tr><tr><td>Номінальний струм вторинної обмотки, А</td><td>3</td></tr><tr><td>Клас точності</td><td>5Р, 10Р</td></tr><tr><td>Максимально-допустима напруга у вимірюваному колі, кВ</td><td>0,72</td></tr></tbody></table> ",Русский ~ Реле дифференциального тока
https://001.com.ua/izmeritelnaya-katushka-e-trans-cur-kct-55s-dlya-rele-tipa-klr-400-3-e-next,new,,,https://001.com.ua/media/photos/enext/rele/enext-izmeritelnaya-katushka-dlya-rele-i0640002-photo.jpg ;; https://001.com.ua/media/photos/enext/rele/gabaritnye-razmery-enext-izmeritelnaya-katushka-dlya-rele-i0640002-photo.jpg,"Измерительная катушка e.trans.cur.kct.55s для реле типа klr, 400/3, E.NEXT",Прочие реле и переключатели,E.NEXT,i0640002,i0640002,instock,1,12,245,"Измерительная катушка e.trans.cur.kct.55s для реле типа klr, 400/3, E.NEXT","<h2>Описание товара</h2><p>Трансформаторы тока предназначены для регистрации возникшего дифференциального тока и передачи его величины измерительному прибору — реле дифференциального тока e.relay.klr. Используются в цепях переменного тока.</p> <h2>Технические характеристики</h2><table><tbody><tr><td>Наибольший рабочий первичный ток, А</td><td>400</td></tr><tr><td>Номинальный ток вторичной обмотки, А</td><td>3</td></tr><tr><td>Класс точности</td><td>5Р, 10Р</td></tr><tr><td>Максимально-допустимое напряжение в измеряемой цепи, кВ</td><td>0,72</td></tr></tbody></table> ","Вимірювальна котушка e.trans.cur.kct.55s для реле типу klr, 400/3, E.NEXT","<h2>Опис товару</h2><p>Трансформатори струму призначені для реєстрації диференційного струму і передачі його величини вимірювальному приладові — реле диференційного струму e.relay.klr. Використовуються в колах змінного струму.</p> <h2>Технічні характеристики</h2><table><tbody><tr><td>Найбільший робочий первинний струм, А</td><td>400</td></tr><tr><td>Номінальний струм вторинної обмотки, А</td><td>3</td></tr><tr><td>Клас точності</td><td>5Р, 10Р</td></tr><tr><td>Максимально-допустима напруга у вимірюваному колі, кВ</td><td>0,72</td></tr></tbody></table> ",Русский ~ Реле дифференциального тока
https://001.com.ua/izmeritelnaya-katushka-e-trans-cur-kct-80s-dlya-rele-tipa-klr-630-3-e-next,new,,,https://001.com.ua/media/photos/enext/rele/enext-izmeritelnaya-katushka-dlya-rele-i0640003-photo.jpg ;; https://001.com.ua/media/photos/enext/rele/gabaritnye-razmery-enext-izmeritelnaya-katushka-dlya-rele-i0640003-photo.jpg,"Измерительная катушка e.trans.cur.kct.80s для реле типа klr, 630/3, E.NEXT",Прочие реле и переключатели,E.NEXT,i0640003,i0640003,instock,1,12,"251,52","Измерительная катушка e.trans.cur.kct.80s для реле типа klr, 630/3, E.NEXT","<h2>Описание товара</h2><p>Трансформаторы тока предназначены для регистрации возникшего дифференциального тока и передачи его величины измерительному прибору — реле дифференциального тока e.relay.klr. Используются в цепях переменного тока.</p> <h2>Технические характеристики</h2><table><tbody><tr><td>Наибольший рабочий первичный ток, А</td><td>630</td></tr><tr><td>Номинальный ток вторичной обмотки, А</td><td>3</td></tr><tr><td>Класс точности</td><td>5Р, 10Р</td></tr><tr><td>Максимально-допустимое напряжение в измеряемой цепи, кВ</td><td>0,72</td></tr></tbody></table> ","Вимірювальна котушка e.trans.cur.kct.80s для реле типу klr, 630/3, E.NEXT","<h2>Опис товару</h2><p>Трансформатори струму призначені для реєстрації диференційного струму і передачі його величини вимірювальному приладові — реле диференційного струму e.relay.klr. Використовуються в колах змінного струму.</p> <h2>Технічні характеристики</h2><table><tbody><tr><td>Найбільший робочий первинний струм, А</td><td>630</td></tr><tr><td>Номінальний струм вторинної обмотки, А</td><td>3</td></tr><tr><td>Клас точності</td><td>5Р, 10Р</td></tr><tr><td>Максимально-допустима напруга у вимірюваному колі, кВ</td><td>0,72</td></tr></tbody></table> ",Русский ~ Реле дифференциального тока
