URL,product_id,Русский slug,Украинский slug,images,item_name,category_name,manufacturer_name,sku,model,stock_status,is_active,warranty,price,Русский title,Русский description,Украинский title,Украинский description,Тип устройства,Способ монтажа
https://001.com.ua/rele-ogranicheniya-moschnosti-om-110-odnofaznoe-novatek,new,,,https://001.com.ua/media/photos/novatek/modulnoe/novatek-rele-ogranicheniya-moschnosti-om-110-photo.jpg ;; https://001.com.ua/media/photos/novatek/modulnoe/gabaritnye-razmery-novatek-om-110-photo.jpg,"Реле ограничения мощности ОМ-110 однофазное, Новатек",Прочие реле и переключатели,Новатек,ОМ-110,ОМ-110,instock,1,12,1 700,"Реле ограничения мощности ОМ-110 однофазное, Новатек","<h2>Описание товара</h2><p><strong>Реле ограничения мощности ОМ-110</strong> предназначено для измерения и постоянного контроля активной или полной мощности однофазной нагрузки.</p><p>Измеряемый и контролируемый диапазон от 0 до 20 кВт или от 0 до 20 кВА.</p><p>Прибор выполняет отключение нагрузки в случае превышения заданного пользователем уровня максимально допустимой мощности потребления нагрузки.</p><p>Уставки максимальной мощности, времени задержки отключения и времени автоматического повторного включения (АПВ) задает пользователь с помощью регуляторов и переключателей, вынесенных на лицевую панель прибора.</p><p>Прибор может быть использован как:</p><ul><li>цифровой ваттметр (измеритель активной или полной мощности);</li><li>реле ограничения потребляемой мощности;</li><li>реле выбора приоритетной нагрузки.</li></ul><p>Прибор подключается без разрыва электрической цепи. Для измерения тока используется встроенный трансформатор тока. Питание прибора осуществляется от цепей измерения напряжения. Прибор отображает значение мощности и состояние нагрузки с помощью индикаторов, расположенных на лицевой панели.</p> <h2>Технические характеристики</h2><table><tbody><tr><td>Назначение устройства</td><td>Аппаратура управления и распределения</td></tr><tr><td>Номинальный режим работы</td><td>продолжительный</td></tr><tr><td>Степень защиты устройства по лицевой панели</td><td>IP40</td></tr><tr><td>Степень защиты устройства по корпусу</td><td>IP20</td></tr><tr><td>Класс защиты от поражения электрическим током</td><td>II</td></tr><tr><td>Климатическое исполнение</td><td>У3.1</td></tr><tr><td>Диапазон рабочих температур, °С</td><td>от минус 20 до +45</td></tr><tr><td>Температура хранения, °С</td><td>от минус 45 до +70</td></tr><tr><td>Допустимая степень загрязнения</td><td>II</td></tr><tr><td>Категория перенапряжения</td><td>II</td></tr><tr><td>Номинальное напряжение изоляции, В</td><td>450</td></tr><tr><td>Номинальное импульсное выдерживаемое напряжение, кВ</td><td>2,5</td></tr><tr><td>Номинальное напряжение, В</td><td>220</td></tr><tr><td>Частота сети, Гц</td><td>47–53</td></tr><tr><td>Диапазон измерения мощности, кВт (кВА)</td><td>0-20,0</td></tr><tr><td>Точность измерения мощности, не хуже</td><td>2,5%</td></tr><tr><td>Диапазон регулирования уставки максимальной мощности:</td><td> </td></tr><tr><td>а) k=1; Wмакс, кВт (кВА)</td><td>0−2,0</td></tr><tr><td>Абсолютная погрешность измерения мощности, не более, кВт (кВА)</td><td>±0,05</td></tr><tr><td>б) k=10; Wмакс, кВт (кВА)</td><td>0–20,0</td></tr><tr><td>Абсолютная погрешность измерения мощности, не более, кВт</td><td>±0,5</td></tr><tr><td>Диапазон регулирования по tвкл, с</td><td>0−900, ∞</td></tr><tr><td>Диапазон регулирования по tоткл, с</td><td>0−300</td></tr><tr><td>Время готовности, не более*, с</td><td>0,8</td></tr><tr><td>Максимальный коммутируемый ток (активной нагрузки), не менее, А</td><td>8</td></tr><tr><td>Минимальное напряжение, при котором сохраняется работоспособность (действующее значение) **, В</td><td>130</td></tr><tr><td>Максимальное напряжение, при котором сохраняется работоспособность (действующее значение), В</td><td>300</td></tr><tr><td>Максимально допустимое напряжение, не более, В</td><td>400</td></tr><tr><td>Ток потребления от сети при неподключенной нагрузке, мА</td><td>до 15</td></tr><tr><td>Коммутационный ресурс выходных контактов:</td><td> </td></tr><tr><td>- под нагрузкой 8 А, не менее, раз</td><td>100 тыс.</td></tr><tr><td>- под нагрузкой 1 А, не менее, раз</td><td>1 млн.</td></tr><tr><td>Масса, не более, кг</td><td>0,200</td></tr><tr><td>Габаритные размеры (при зафиксированой защелке) (типоразмер – 3 стандартных S-модуля на DIN-рейку 35 мм, см. рис.), мм</td><td>52,6×90×69,1</td></tr><tr><td>Монтаж</td><td>на стандартную DIN-рейку 35 мм</td></tr><tr><td>Положение в пространстве</td><td>произвольное</td></tr></tbody></table><p>* Время реакции при подаче питания не больше 2 секунд (время включает в себя автокалибровку, включение нагрузки, измерение тока и отключение нагрузки в случае определения аварийной ситуации).<br/> ** Происходит отключение индикатора при напряжении питания менее 130 Вольт и блокировка функционирования при напряжении ниже 110 Вольт.</p> ","Реле обмеження потужності ОМ-110 однофазне, Новатек","<h2>Опис товару</h2><p><strong>Реле обмеження потужності ОМ-110</strong> призначене для вимірювання та постійного контролю активної або повної потужності однофазного навантаження.</p><p>Вимірюваний і контрольований діапазон від 0 до 20 кВт або від 0 до 20 кВА.</p><p>Прилад виконує відключення навантаження в разі перевищення заданого користувачем рівня максимально допустимої потужності споживання навантаження.</p><p>Уставки максимальної потужності, часу затримки відключення і часу автоматичного повторного включення (АПВ) задає користувач за допомогою регуляторів і перемикачів, винесених на лицьову панель приладу.</p><p>Прилад може бути використаний як:</p><ul><li>цифровий ватметр (вимірювач активної або повної потужності);</li><li>реле обмеження споживаної потужності;</li><li>реле вибору пріоритетного навантаження.</li></ul><p>Прилад підключається без розриву електричного кола. Для вимірювання струму використовується вбудований трансформатор струму. Живлення приладу здійснюється від кіл вимірювання напруги. Прилад відображає значення потужності і стан навантаження за допомогою індикаторів, розташованих на лицьовій панелі.</p> <h2>Технічні характеристики</h2><table><tbody><tr><td>Призначення пристрою</td><td>Апаратура керування і розподілення</td></tr><tr><td>Номінальний режим роботи</td><td>тривалий</td></tr><tr><td>Ступінь захисту пристрою за лицьовою панеллю</td><td>IP40</td></tr><tr><td>Ступінь захисту пристрою за корпусом</td><td>IP20</td></tr><tr><td>Клас захисту від ураження електричним струмом</td><td>II</td></tr><tr><td>Кліматичне виконання</td><td>У3.1</td></tr><tr><td>Діапазон робочих температур, °С</td><td>від мінус 20 до +45</td></tr><tr><td>Температура зберігання, °С</td><td>від мінус 45 до +70</td></tr><tr><td>Допустима ступінь забруднення</td><td>II</td></tr><tr><td>Категорія перенапруги</td><td>II</td></tr><tr><td>Номінальна напруга ізоляції, В</td><td>450</td></tr><tr><td>Номінальна імпульсна витримувана напруга, кВ</td><td>2,5</td></tr><tr><td>Номінальна напруга, В</td><td>220</td></tr><tr><td>Частота мережі, Гц</td><td>47–53</td></tr><tr><td>Діапазон вимірювання потужності, кВт (кВА)</td><td>0-20,0</td></tr><tr><td>Точність вимірювання потужності, не гірше</td><td>2,5%</td></tr><tr><td>Діапазон регулювання уставки максимальної потужності:</td><td> </td></tr><tr><td>а) k=1; Wмакс, кВт (кВА)</td><td>0−2,0</td></tr><tr><td>Абсолютна похибка вимірювання потужності, не більше, кВт (кВА)</td><td>±0,05</td></tr><tr><td>б) k=10; Wмакс, кВт (кВА)</td><td>0–20,0</td></tr><tr><td>Абсолютна похибка вимірювання потужності, не більше, кВт</td><td>±0,5</td></tr><tr><td>Діапазон регулювання за tвкл, с</td><td>0−900, ∞</td></tr><tr><td>Діапазон регулювання за tоткл, с</td><td>0−300</td></tr><tr><td>Час готовності, не більше*, с</td><td>0,8</td></tr><tr><td>Максимальний комутований струм (активного навантаження), не менше, А</td><td>8</td></tr><tr><td>Мінімальна напруга, при якій зберігається роботоздатність (діюче значення) **, В</td><td>130</td></tr><tr><td>Максимальна напруга, при якій зберігається роботоздатність (діюче значення), В</td><td>300</td></tr><tr><td>Максимально допустима напруга, не більше, В</td><td>400</td></tr><tr><td>Струм споживання від мережі при непідключеному навантаженні, мА</td><td>до 15</td></tr><tr><td>Комутаційний ресурс вихідних контактів:</td><td> </td></tr><tr><td>- під навантаженням 8 А, не менше, разів</td><td>100 тис.</td></tr><tr><td>- під навантаженням 1 А, не менше, разів</td><td>1 млн.</td></tr><tr><td>Маса, не більше, кг</td><td>0,200</td></tr><tr><td>Габаритні розміри (при зафіксованій засувці) (типорозмір – 3 стандартних S-модулі на DIN-рейку 35 мм, див. рис.), мм</td><td>52,6×90×69,1</td></tr><tr><td>Монтаж</td><td>на стандартну DIN-рейку 35 мм</td></tr><tr><td>Положення в просторі</td><td>довільне</td></tr></tbody></table><p>* Час реакції при подачі живлення не більше 2 секунд (час включає в себе автокалібрування, включення навантаження, вимірювання струму і відключення навантаження у разі визначення аварійної ситуації).<br/>** Відбувається відключення індикатора при напрузі живлення менше 130 Вольт і блокування функціонування при напрузі нижче 110 Вольт.</p> ",Русский ~ Реле контроля мощности,Русский ~ DIN-рейка
