URL,product_id,Русский slug,Украинский slug,images,item_name,category_name,manufacturer_name,sku,model,stock_status,is_active,warranty,price,Русский title,Русский description,Украинский title,Украинский description,Тип устройства,Максимальный ток,Способ монтажа,Количество каналов,Дополнительно,Номинальное напряжение питания,Количество и вид контактов,Максимальное число программных операций,Минимальный интервал времени
https://001.com.ua/taymer-elektronnyy-nedelnyy-dvuhkanalnyy-e-control-t09-e-next,new,,,https://001.com.ua/media/photos/enext/rele/enext-timer-i0310012-photo.jpg ;; https://001.com.ua/media/photos/enext/rele/gabaritnye-razmery-enext-timer-i0310012-photo.jpg ;; https://001.com.ua/media/photos/enext/rele/schema-enext-timer-i0310012-photo.jpg,"Таймер электронный недельный двухканальный e.control.t09, E.NEXT",Таймеры,E.NEXT,i0310012,i0310012,instock,1,12,"1 090,42","Таймер электронный недельный двухканальный e.control.t09, E.NEXT","<h2>Описание товара</h2><p>Предназначен для автоматического включения и отключения двух групп электротехнического оборудования независимо друг от друга через установленные промежутки времени в течение недели в цепях автоматики и управления различными технологическими процессами.</p><p>Изделие соответствует ДСТУ 4176-2003, ДСТУ IEC 60947-1:2008.</p><p>Таймер электронный e.control.t09 имеет модульное исполнение, с шириной корпуса 36 мм (2 модуля). Корпус изделия выполнен из АВS-пластика не поддерживающего горение. На лицевой панели таймера под прозрачной, имеющей возможность пломбировки, крышкой расположены: кнопки настройки текущего времени и программирования таймера; жидкокристаллический дисплей с подсветкой. Встроенный литиевый аккумулятор обеспечивает сохранность программы таймера при исчезновении напряжения питания в течение 10 лет. Микропроцессор таймера обеспечивает выполнение недельной программы управления с количеством программ до 100 по двум независимым каналам и выполнение программы по дням недели. В данном режиме таймер будет включаться и выключаться в соответствии с установленной программой. При необходимости таймер можно перевести в режим «Выходной» во время которого не будет выполняться установленная программа. При этом программа будет сохранена, а перекидные контакты таймера будут постоянно находиться в исходном состоянии: 15-16, 25-26 — замкнуты; 15-18, 25-28 — разомкнуты.</p> <h2>Технические характеристики</h2><table><tbody><tr><td>Номинальное напряжение цепи питания, В</td><td>AC/DC 24-264</td></tr><tr><td>Номинальное напряжение цепи управления, В</td><td>230</td></tr><tr><td>Напряжение изоляции, Ui, В</td><td>250</td></tr><tr><td>Максимальный коммутируемый ток контактов, А<br/>при cosφ = 1<br/>при cosφ = 0,7</td><td><br/>16<br/>10</td></tr><tr><td>Максимальное количество программ</td><td>100</td></tr><tr><td>Категория применения</td><td>АС-1</td></tr><tr><td>Тип и количество контактов</td><td>2 C/O</td></tr><tr><td>Максимально коммутируемая мощность</td><td>4 000 ВА/АС1; 384 Вт/DC</td></tr><tr><td>Погрешность отсчета времени, с /сутки, не более</td><td>±1</td></tr><tr><td>Время работы от аккумулятора, лет, не менее</td><td>10</td></tr><tr><td>Потребляемая мощность, ВА, не более</td><td>2</td></tr><tr><td>Электрическая износостойкость, циклов В/О, не менее</td><td>10<sup>5</sup></td></tr><tr><td>Механическая износостойкость, циклов В/О, не менее</td><td>10<sup>6</sup></td></tr><tr><td>Максимальное сечение присоединяемых проводников, мм²</td><td>4</td></tr><tr><td>Усилие затяжки контактных зажимов, Нм</td><td>0,5</td></tr><tr><td>Степень защиты</td><td>IP20</td></tr><tr><td>Масса, г, не более</td><td>200</td></tr><tr><td>Диапазон рабочих температур, °C</td><td>-20...+55</td></tr><tr><td>Климатическое исполнение</td><td>УХЛ4</td></tr><tr><td>Группа условий эксплуатации в части воздействия механических факторов</td><td>М1</td></tr><tr><td>Высота над уровнем моря, не более, м</td><td>2 000</td></tr><tr><td>Допустимая относительная влажность при 40 °C (без конденсации), не более, %</td><td>50%</td></tr><tr><td>Степень загрязнения среды</td><td>3</td></tr><tr><td>Рабочее положение</td><td>произвольное</td></tr><tr><td>Монтаж</td><td>на DIN-рейке 35 мм</td></tr></tbody></table> ","Таймер електронний тижневий двоканальний e.control.t09, E.NEXT","<h2>Опис товару</h2><p>Призначений для автоматичного включення і відключення двох груп електротехнічного обладнання незалежно один від одного через певні проміжки часу протягом тижня в колах автоматики і керування різними технологічними процесами.</p><p>Виріб відповідає ДСТУ 4176-2003, ДСТУ IEC 60947-1:2008.</p><p>Таймер електронний e.control.t09 має модульне виконання, з шириною корпусу 36 мм (2 модулі). Корпус виробу виконаний з АВS-пластика, що не підтримує горіння. На лицьовій панелі таймера під прозорою, що має можливість пломбування, кришкою розташовані: кнопки налаштування поточного часу і програмування таймера; рідкокристалічний дисплей з підсвічуванням. Вбудований літієвий акумулятор забезпечує збереження програми таймера при зникненні напруги живлення протягом 10 років. Мікропроцесор таймера забезпечує виконання тижневої програми керування з кількістю програм до 100 по двох незалежних каналах і виконання програми по днях тижня. В даному режимі таймер буде включатися і вимикатися відповідно до встановленої програми. При необхідності таймер можна перевести в режим «Вихідний», під час якого не буде виконуватися встановлена ​​програма. При цьому програма буде збережена, а перекидні контакти таймера будуть постійно перебувати в початковому стані: 15-16, 25-26 — замкнуті; 15-18, 25-28 — розімкнуті.</p> <h2>Технічні характеристики</h2><table><tbody><tr><td>Номінальна напруга кола живлення, В</td><td>AC/DC 24-264</td></tr><tr><td>Номінальна напруга кола керування, В</td><td>230</td></tr><tr><td>Напруга ізоляції, Ui, В</td><td>250</td></tr><tr><td>Максимальний комутований струм контактів, А <br/>при cos φ = 1 <br/>при cos φ = 0,7</td><td><br/>16 <br/>10</td></tr><tr><td>Максимальна кількість програм</td><td>100</td></tr><tr><td>Категорія застосування</td><td>АС-1</td></tr><tr><td>Тип і кількість контактів</td><td>2 C/O</td></tr><tr><td>Максимально комутована потужність</td><td>4 000 ВА / АС1; 384 Вт / DC</td></tr><tr><td>Похибка відліку часу, с/добу, не більше</td><td>±1</td></tr><tr><td>Час роботи від акумулятора, років, не менше</td><td>10</td></tr><tr><td>Споживана потужність, ВА, не більше</td><td>2</td></tr><tr><td>Електрична зносостійкість, циклів Вкл/Відкл, не менше</td><td>10<sup>5</sup></td></tr><tr><td>Механічна зносостійкість, циклів Вкл/Відкл, не менше</td><td>10<sup>6</sup></td></tr><tr><td>Максимальний перетин приєднуваних провідників, мм²</td><td>4</td></tr><tr><td>Зусилля затяжки контактних затискачів, Нм</td><td>0,5</td></tr><tr><td>Ступінь захисту</td><td>IP20</td></tr><tr><td>Маса, г, не більше</td><td>200</td></tr><tr><td>Діапазон робочих т емператур, °C</td><td>-20 ... +55</td></tr><tr><td>Кліматичне виконання</td><td>УХЛ4</td></tr><tr><td>Група умов експлуатації в частині впливу механічних факторів</td><td>М1</td></tr><tr><td>Висота над рівнем моря, не більше, м</td><td>2 000</td></tr><tr><td>Допустима відносна вологість при 40 °C (без конденсації), не більше, %</td><td>50%</td></tr><tr><td>Ступінь забруднення середовища</td><td>3</td></tr><tr><td>Робоче положення</td><td>довільне</td></tr><tr><td>Монтаж</td><td>на DIN-рейці 35 мм</td></tr></tbody></table> ",Русский ~ Недельный таймер,Русский ~ 16,Русский ~ DIN-рейка,Русский ~ 2,Русский ~ Резерв хода,Русский ~ 24-264 AC/DC,Русский ~ 2 перекидных,Русский ~ 100,Русский ~ 1 минута
https://001.com.ua/taymer-nedelnyy-elektronnyy-thc15-asko-ukrem,new,,,https://001.com.ua/media/photos/asko/rele/asko-timer-thc15-photo.jpg ;; https://001.com.ua/media/photos/asko/rele/gabaritnye-razmery-asko-ukrem-timer-thc15-photo.jpg ;; https://001.com.ua/media/photos/asko/rele/scheme-asko-ukrem-timer-thc15-photo.jpg,"Таймер недельный электронный THC15, АСКО-УКРЕМ",Таймеры,АСКО-УКРЕМ,A0090040005,A0090040005,instock,1,12,"698,69","Таймер недельный электронный THC15, АСКО-УКРЕМ","<h2>Описание товара</h2><p>Предназначен для отсчета интервалов времени, автоматического включения/отключения электротехнического оборудования через заданный промежуток времени в течение недели и управления различными технологическими процессами. Таймер имеет один переключающий контакт.</p><p>Применяются в низковольтных системах управления промышленных, общественных и жилых объектов.</p><p>Модификация ТНС15-ТС – с прозрачной откидной верхней крышкой.</p><p>Соответствуют ДСТУ IEC 60947-6-2.</p> <h2>Технические характеристики</h2><table><tbody><tr><td>Номинальное рабочее напряжение, В (AC, 50Гц)</td><td>220</td></tr><tr><td>Диапазон рабочего напряжения, В (AC, 50Гц)</td><td>180…240</td></tr><tr><td>Номинальное напряжение изоляции Ui, В</td><td>500</td></tr><tr><td>Номинальное импульсное напряжение Uimp, кB</td><td>4</td></tr><tr><td>Кол-во программ управления</td><td>16</td></tr><tr><td>Шаг уставки времени, мин</td><td>1</td></tr><tr><td>*Суточная временная погрешность, сек</td><td>2</td></tr><tr><td>Максимальный ток коммутации Imax, A</td><td>16</td></tr><tr><td>Мощность потребления Рпотр, Вт не более</td><td>4</td></tr><tr><td>**Износостойкость, циклов ВО<br/>электрическая<br/>механическая</td><td><br/>10<sup>4</sup><br/>10<sup>5</sup></td></tr><tr><td>Степень защиты</td><td>IP30</td></tr><tr><td>Вес, кг</td><td>0,15</td></tr><tr><td>Температура эксплуатации, °C</td><td>-10…+45</td></tr></tbody></table><p>*При температуре от 25±1°C и относительной влажности воздуха не более 75%.<br/>**При коммутации токов, не превышающих 0,7 Imax.</p><p>Установленный в качестве источника питания аккумулятор, при времени зарядки более 16-ти часов, обеспечивает функциональность таймера в течение трёх суток.</p> ","Таймер тижневий електронний THC15, АСКО-УКРЕМ","<h2>Опис товару</h2><p>Призначений для відліку інтервалів часу, автоматичного включення/відключення електротехнічного обладнання через заданий проміжок часу протягом тижня і керування різними технологічними процесами. Таймер має один перемикаючий контакт.</p><p>Застосовуються в низьковольтних системах керування промислових, громадських і житлових об'єктів.</p><p>Модифікація ТНС15-ТС – з прозорою відкидною верхньою кришкою.</p><p>Відповідають ДСТУ IEC 60947-6-2.</p> <h2>Технічні характеристики</h2><table><tbody><tr><td>Номінальна робоча напруга, В (AC, 50 Гц)</td><td>220</td></tr><tr><td>Діапазон робочої напруги, В (AC, 50 Гц)</td><td>180…240</td></tr><tr><td>Номінальна напруга ізоляції Ui, В</td><td>500</td></tr><tr><td>Номінальна імпульсна напруга Uimp, кB</td><td>4</td></tr><tr><td>Кількість програм керування</td><td>16</td></tr><tr><td>Крок уставки часу, хв</td><td>1</td></tr><tr><td>*Добова часова похибка, с</td><td>2</td></tr><tr><td>Максимальний струм комутації Imax, A</td><td>16</td></tr><tr><td>Потужність споживання Рспож, Вт не більше</td><td>4</td></tr><tr><td>** Зносостійкість, циклів Вкл-Відкл <br/>електрична <br/>механічна</td><td><br/>10<sup>4</sup><br/>10<sup>5</sup></td></tr><tr><td>Ступінь захисту</td><td>IP30</td></tr><tr><td>Вага, кг</td><td>0,15</td></tr><tr><td>Температура експлуатації, °C</td><td>-10…+45</td></tr></tbody></table><p>* При температурі від 25±1°C і відносній вологості повітря не більше 75%. <br/>** При комутації струмів, що не перевищують 0,7 Imax.</p><p>Встановлений в якості джерела живлення акумулятор, при часу зарядки більше 16-ти годин, забезпечує функціональність таймера протягом трьох діб.</p> ",Русский ~ Недельный таймер,Русский ~ 16,Русский ~ DIN-рейка,Русский ~ 1,Русский ~ Резерв хода,Русский ~ 230 AC,Русский ~ 1 перекидной,Русский ~ 16,Русский ~ 1 минута
